{"canonicalization":"wordpress-hx.canonical-json.v1","generator":{"collectorId":"wordpress-hx.build.semantic-plan","collectorSourceSha256":"3a848b6bbe8278efdb2e220e5f879446c90cdad60090f472cf6a422cea53ab5d","collectorVersion":"contract-v1","sdkVersion":"0.0.0-dev","toolchainSha256":"67ea4ea71ae718c1f9dcfacaccb03273276cec3d48bac2c1628add2bcdaf7f10"},"nodeSchemas":[{"authority":"core","consumerEmitters":["wordpress.php"],"kind":"wordpress.hook","schemaId":"wordpress-hx.semantic-node.wordpress.hook.v1","schemaSha256":"f9adbb92bd3023c60cf32ec67e0c09a5645f3072f78ec3dd1ff0452d772a6695","version":1},{"authority":"core","consumerEmitters":["wordpress.php"],"kind":"wordpress.module","schemaId":"wordpress-hx.semantic-node.wordpress.module.v1","schemaSha256":"f4921d090f5d06acd41d37bd3d43314df39661b6629cb3dc0b7b73da9df873b0","version":1}],"nodes":[{"dependsOn":["module/acme-observatory"],"id":"hook/acme-observatory/init/register-visits","kind":"wordpress.hook","payload":{"acceptedArgs":0,"callbackSymbol":"Acme\\Observatory\\registerVisits","hookName":"init","hookType":"action","priority":10},"profileCapabilities":["wordpress.hook.init","wordpress.php.function.add_action"],"projections":[{"artifactKind":"hook.registration.php","emitterId":"wordpress.php","projectionId":"php/acme-observatory/hooks/init/register-visits"}],"relatedSources":[],"schemaId":"wordpress-hx.semantic-node.wordpress.hook.v1","source":{"end":{"column":48,"line":7,"offset":201},"path":"fixtures/semantic-plan/src/SemanticPlanFixture.hx","sourceSha256":"462105433b9a20dde949d7749c9897de0da223f86d6029d0b62fbc32ec71dd54","start":{"column":1,"line":7,"offset":154},"symbol":"fixtures.semanticplan.SemanticPlanFixture.registerVisits"}},{"dependsOn":[],"id":"module/acme-observatory","kind":"wordpress.module","payload":{"displayName":"Acme Observatory","moduleId":"acme-observatory","moduleType":"plugin","namespace":"Acme\\Observatory","version":"0.1.0"},"profileCapabilities":[],"projections":[{"artifactKind":"plugin.bootstrap.php","emitterId":"wordpress.php","projectionId":"php/acme-observatory/bootstrap"}],"relatedSources":[],"schemaId":"wordpress-hx.semantic-node.wordpress.module.v1","source":{"end":{"column":51,"line":4,"offset":111},"path":"fixtures/semantic-plan/src/SemanticPlanFixture.hx","sourceSha256":"462105433b9a20dde949d7749c9897de0da223f86d6029d0b62fbc32ec71dd54","start":{"column":1,"line":4,"offset":61},"symbol":"fixtures.semanticplan.SemanticPlanFixture.moduleId"}}],"planDigest":"77292124c75633926f84475b14a02d84cb33f00145c60d3cef6e8f591cca1e74","planDigestAlgorithm":"sha256-canonical-json-without-planDigest-v1","profile":{"catalogRevision":"wp70-release/catalog-v1","catalogSha256":"530a1581d07e7509fb68f7da5b53575009ed4a94280513efd82a8c99622d9d61","profileId":"wp70-release"},"project":{"projectId":"acme-observatory","projectVersion":"0.1.0","sourceTreeSha256":"f4eb38f34bc4aa1e048dd382379b86cb6d209a3e31d482c55d31a14e59722f2c"},"schema":"wordpress-hx.semantic-plan.v1"}
